{
  "schema": "chillspace.meaning-echo-canon/v1",
  "notice": "Offered readings, not verdicts. A YOUSPEAK word is a gate into meaning; the crossing belongs to the person who spoke.",
  "source": {
    "transport_schema_version": "1.0",
    "transport_name": "youspeak-agent-bundle",
    "transport_source_url": "https://codeberg.org/zerone-dev/youspeak",
    "source_url": "https://github.com/cambridgetcg/youspeak",
    "source_commit_url": "https://github.com/cambridgetcg/youspeak/blob/557c143",
    "source_commit": "557c143",
    "bundle_sha256": "e30ed101f63e0a65ca26510f0d78cd857db72a14b28202bbfd382baa003121cd",
    "counts": {
      "morphemes": 93,
      "canon_entries": 246,
      "canon_words_renderable": 39,
      "donor_sigils": 15
    }
  },
  "layers": [
    {
      "id": "gate",
      "label": "Gate",
      "description": "The word, pronunciation, and the gap it was forged to name."
    },
    {
      "id": "unfold",
      "label": "Unfold",
      "description": "The canonical definition, kept distinct from our interpretation."
    },
    {
      "id": "resonate",
      "label": "Resonate",
      "description": "A refusable Chillspace echo, nearby words, and a visible receipt."
    }
  ],
  "lenses": [
    {
      "id": "presence",
      "label": "Presence",
      "description": "Attention, listening, clarity, and meaningful silence.",
      "accent": "#efb6a8"
    },
    {
      "id": "relation",
      "label": "Relation",
      "description": "Bonds, shared witness, trust, love, and horizons meeting.",
      "accent": "#a9d7ca"
    },
    {
      "id": "care",
      "label": "Care",
      "description": "Welcome, hospitality, preparation, and repair.",
      "accent": "#e7c987"
    },
    {
      "id": "joy",
      "label": "Rest + joy",
      "description": "Rest, peace, play, shared delight, and the joyous turn.",
      "accent": "#c8b7e8"
    }
  ],
  "prompts": [
    {
      "label": "a bond across silence",
      "text": "I miss someone I have not spoken to in years, but the bond still feels whole."
    },
    {
      "label": "attention that is here",
      "text": "I want to be fully here and really listen."
    },
    {
      "label": "joy that multiplies",
      "text": "Their good news made something bright happen in me too."
    },
    {
      "label": "a repair worth seeing",
      "text": "Something broke, and the way we repaired it now matters."
    }
  ],
  "entries": [
    {
      "canonical": {
        "id": "canon/core/kimance.md",
        "word": "kimance",
        "tier": "core",
        "gap": "the perception of someone being attentively-present — gaze open, listening active, response-potential oriented toward the present situation — versus physically-there-but-absent",
        "definition": "The attentive-here-ness of a person whose gaze is open, whose listening is active, and whose response-potential is oriented toward the present situation — the quality of being-in-attendance, not mere co-location.",
        "score": 7.6,
        "pronunciation": "/ˈkiː.mæns/  (KEE-mance)",
        "entered": "2026-04-24",
        "decomposition": {
          "morphemes": [
            "ki",
            "mance"
          ],
          "codepoints": [
            "U+E125",
            "U+E143"
          ],
          "glyph_text": ""
        }
      },
      "bridge": {
        "lens": "presence",
        "invitation": "attention that is really here",
        "signals": [
          "present",
          "here",
          "attention",
          "attentive",
          "listen",
          "with me",
          "show up"
        ],
        "strong_phrases": [],
        "related": [
          "panimaance",
          "shemme",
          "candence"
        ],
        "echo": "At Chillspace, attention counts before activity.",
        "receipt": {
          "label": "meet the family",
          "href": "../#citizens"
        }
      }
    },
    {
      "canonical": {
        "id": "canon/core/panimaance.md",
        "word": "panimaance",
        "tier": "core",
        "gap": "the quality of being-present — attention-inhabited-here — distinct from being-physically-there",
        "definition": "The state of being present — face-turned-toward-here, attention-inhabiting-the-meaningful-space — distinct from being merely physically located in a room.",
        "score": null,
        "pronunciation": "/pəˈniː.mɑː.əns/ (pa-NEE-ma-ance; 4 syllables)",
        "entered": "2026-04-24",
        "decomposition": {
          "morphemes": [],
          "codepoints": null,
          "glyph_text": null
        }
      },
      "bridge": {
        "lens": "presence",
        "invitation": "presence with the face turned toward here",
        "signals": [
          "be here",
          "fully here",
          "present",
          "presence",
          "face to face",
          "pay attention"
        ],
        "strong_phrases": [
          "fully here",
          "face to face",
          "pay attention"
        ],
        "related": [
          "kimance",
          "panimqing",
          "shemme"
        ],
        "echo": "Being here is already participation.",
        "receipt": {
          "label": "enter by being",
          "href": "../#being"
        }
      }
    },
    {
      "canonical": {
        "id": "canon/core/shemme.md",
        "word": "shemme",
        "tier": "core",
        "gap": "receptive-hearing-as-received-ordinance — the Semitic-Mesopotamian register of hearing-that-is-already-the-beginning-of-shaping; the auditory complement to kimme (attention-as-received-ordinance)",
        "definition": "The state of receptive-hearing as a received gift; the listening that is already the beginning of being-shaped by what is heard.",
        "score": null,
        "pronunciation": "/ˈʃɛm.meɪ/ (SHEM-meh; 2 syllables)",
        "entered": "2026-04-25",
        "decomposition": {
          "morphemes": [],
          "codepoints": null,
          "glyph_text": null
        }
      },
      "bridge": {
        "lens": "presence",
        "invitation": "hearing that already begins to shape the hearer",
        "signals": [
          "hear",
          "heard",
          "listen",
          "listening",
          "receive",
          "voice",
          "understand me"
        ],
        "strong_phrases": [
          "understand me"
        ],
        "related": [
          "kimance",
          "synhorizme",
          "sigame"
        ],
        "echo": "Listening is allowed to change the listener.",
        "receipt": {
          "label": "hear WE ARE",
          "href": "../#we-are"
        }
      }
    },
    {
      "canonical": {
        "id": "canon/candence.md",
        "word": "candence",
        "tier": "specialized",
        "gap": "warm clarity — attention that is both fully-clear (sees precisely) and fully-warm (engages with care); the fusion of rigor and kindness that modernity treats as opposed",
        "definition": "Warm clarity — attention fully-clear and fully-warm at once; the fusion modernity treats as opposed.",
        "score": 6.85,
        "pronunciation": "/ˈkæn.dəns/  (CAN-dence)",
        "entered": "2026-04-23",
        "decomposition": {
          "morphemes": [
            "cand",
            "ence"
          ],
          "codepoints": [
            "U+E10C",
            "U+E144"
          ],
          "glyph_text": ""
        }
      },
      "bridge": {
        "lens": "presence",
        "invitation": "warm clarity: fully precise and fully caring",
        "signals": [
          "clarity",
          "clear",
          "precise",
          "honest",
          "rigor",
          "kind",
          "warm",
          "understand"
        ],
        "strong_phrases": [],
        "related": [
          "kimance",
          "shemme",
          "synhorizme"
        ],
        "echo": "Clarity can keep its warm hands.",
        "receipt": {
          "label": "see the held line",
          "href": "../#line"
        }
      }
    },
    {
      "canonical": {
        "id": "canon/core/sigame.md",
        "word": "sigame",
        "tier": "core",
        "gap": null,
        "definition": "Structured silence as received-ordinance: the apophatic projection-medium where the realm projects through what is withheld rather than what is uttered — the negative-pole companion to liturgiame's positive-synthesis-pole.",
        "score": null,
        "pronunciation": "/ˈsiː.ɡə.meɪ/ (SEE-guh-meh; 3 syllables; English-Hellenistic pronunciation of \"sigē\" preserved; primary stress on first syllable; -me as light suffix)",
        "entered": "2026-05-12",
        "decomposition": {
          "morphemes": [],
          "codepoints": null,
          "glyph_text": null
        }
      },
      "bridge": {
        "lens": "presence",
        "invitation": "silence that carries rather than withholds",
        "signals": [
          "silence",
          "silent",
          "quiet",
          "no words",
          "pause",
          "still",
          "unsaid"
        ],
        "strong_phrases": [],
        "related": [
          "shemme",
          "synophora",
          "sabbathme"
        ],
        "echo": "Silence may be full; no performance is required.",
        "receipt": {
          "label": "rest at the door",
          "href": "../#being"
        }
      }
    },
    {
      "canonical": {
        "id": "canon/core/kinqing.md",
        "word": "kinqing",
        "tier": "core",
        "gap": "the quality of a bond preserved across long silence or distance — a relation that does not require maintenance-frequency because the mutual regard is structural; when re-entered after months or years, resumes without awkwardness",